Anime ID,Title,Type,Score,Episodes,Popularity,Members,Genres,Studios,Year,Season,Updated_At
48418,The Misfit of Demon King Academy II Part 2,TV,6.45,12,1378,190141,"Action, Fantasy",SILVER LINK.,2024,spring,2025-07-06
53434,An Archdemon's Dilemma: How to Love Your Elf Bride,TV,7.29,12,1411,185312,"Action, Fantasy, Romance",Brain's Base,2024,spring,2025-07-06
53770,Go! Go! Loser Ranger!,TV,7.32,12,1429,181381,"Action, Fantasy",Yostar Pictures,2024,spring,2025-07-06
58125,Look Back,Movie,8.64,1,1455,178571,Drama,Studio DURIAN,2024,spring,2025-07-06
55265,"As a Reincarnated Aristocrat, I'll Use My Appraisal Skill to Rise in the World",TV,7.17,12,1506,172673,"Adventure, Fantasy",studio MOTHER,2024,spring,2025-07-06
56690,Re:Monster,TV,6.55,12,1549,167907,"Action, Adventure, Fantasy",Studio Deen,2024,spring,2025-07-06
50713,The Irregular at Magic High School Season 3,TV,7.04,13,1712,145651,"Action, Fantasy, Romance, Sci-Fi",8bit,2024,spring,2025-07-06
53835,Unnamed Memory,TV,6.77,12,1722,144620,"Adventure, Fantasy, Romance",ENGI,2024,spring,2025-07-06
56230,Grandpa and Grandma Turn Young Again,TV,7.46,11,1772,138838,"Comedy, Romance, Supernatural",Gekkou,2024,spring,2025-07-06
53865,Mission: Yozakura Family,TV,7.56,27,1797,137149,"Action, Comedy",SILVER LINK.,2024,spring,2025-07-06
57100,The New Gate,TV,6.45,12,1831,134724,"Action, Adventure, Fantasy","Yokohama Animation Laboratory, Cloud Hearts",2024,spring,2025-07-06
52196,Date A Live V,TV,7.69,12,1885,129646,"Action, Fantasy, Romance, Sci-Fi",Geek Toys,2024,spring,2025-07-06
53407,Bartender Glass of God,TV,7.38,12,1916,126786,"Drama, Gourmet",Liber,2024,spring,2025-07-06
55597,A Condition Called Love,TV,6.75,12,1943,124860,Romance,East Fish Studio,2024,spring,2025-07-06
54839,Jellyfish Can't Swim in the Night,TV,7.75,12,1956,123821,Drama,Doga Kobo,2024,spring,2025-07-06
55791,[Oshi No Ko] Season 2,TV,8.56,13,549,451214,Drama,Doga Kobo,2024,summer,2025-07-06
54744,Alya Sometimes Hides Her Feelings in Russian,TV,7.58,12,584,429074,"Comedy, Romance",Doga Kobo,2024,summer,2025-07-06
58059,Wistoria: Wand and Sword,TV,7.87,12,870,308017,"Action, Fantasy","Actas, Bandai Namco Pictures",2024,summer,2025-07-06
57524,Makeine: Too Many Losing Heroines!,TV,8.12,12,930,284045,"Comedy, Romance",A-1 Pictures,2024,summer,2025-07-06
52635,Tower of God Season 2: Return of the Prince,TV,6.68,13,993,268172,"Action, Adventure, Drama, Fantasy, Mystery",The Answer Studio,2024,summer,2025-07-06
58426,My Deer Friend Nokotan,TV,6.99,12,1043,253921,Comedy,Wit Studio,2024,summer,2025-07-06
52367,No Longer Allowed in Another World,TV,7.27,12,1255,210218,"Adventure, Comedy, Fantasy",Atelier Pontdarc,2024,summer,2025-07-06
57892,Failure Frame: I Became the Strongest and Annihilated Everything With Low-Level Spells,TV,6.48,12,1317,199821,"Action, Adventure, Fantasy",Seven Arcs,2024,summer,2025-07-06
54968,Pseudo Harem,TV,7.84,12,1360,192571,"Comedy, Romance",Nomad,2024,summer,2025-07-06
52481,Days with My Stepsister,TV,7.33,12,1386,188952,Romance,Studio Deen,2024,summer,2025-07-06
57058,I Parry Everything,TV,6.89,12,1394,186915,"Action, Adventure, Fantasy",OLM,2024,summer,2025-07-06
54724,The Elusive Samurai,TV,7.8,12,1417,184312,"Adventure, Comedy",CloverWorks,2024,summer,2025-07-06
54913,"The Ossan Newbie Adventurer, Trained to Death by the Most Powerful Party, Became Invincible",TV,7.37,12,1477,176111,"Action, Adventure, Fantasy",Yumeta Company,2024,summer,2025-07-06
49785,Fairy Tail: 100 Years Quest,TV,7.61,25,1603,159821,"Action, Adventure, Fantasy",J.C.Staff,2024,summer,2025-07-06
55848,Suicide Squad Isekai,TV,6.42,10,1653,153403,"Action, Fantasy",Wit Studio,2024,summer,2025-07-06
53802,2.5 Dimensional Seduction,TV,7.43,24,1770,139567,"Comedy, Ecchi",J.C.Staff,2024,summer,2025-07-06
57876,The Strongest Magician in the Demon Lord's Army Was a Human,TV,6.41,12,1788,137545,"Action, Adventure, Fantasy",Studio A-CAT,2024,summer,2025-07-06
56062,Why Does Nobody Remember Me in This World?,TV,6.23,12,1927,125833,"Action, Fantasy, Sci-Fi",Project No.9,2024,summer,2025-07-06
57810,Shoshimin: How to Become Ordinary,TV,7.34,10,1949,124211,Mystery,Lapin Track,2024,summer,2025-07-06
56063,NieR:Automata Ver1.1a (Cour 2),TV,8.05,12,2278,99878,"Action, Fantasy, Sci-Fi",A-1 Pictures,2024,summer,2025-07-06
49981,Our Last Crusade or the Rise of a New World Season 2,TV,6.74,12,2303,98551,"Action, Fantasy, Romance","SILVER LINK., Studio Palette",2024,summer,2025-07-06
48896,Overlord: The Sacred Kingdom,Movie,7.76,1,2308,98173,"Action, Adventure, Fantasy",Madhouse,2024,summer,2025-07-06
57217,The Magical Girl and the Evil Lieutenant Used to Be Archenemies,TV,7.56,12,2357,94762,"Comedy, Romance",Bones,2024,summer,2025-07-06
56538,Kimi ni Todoke: From Me to You Season 3,ONA,8.47,5,2361,94581,"Drama, Romance",Production I.G,2024,summer,2025-07-06
57864,Monogatari Series: Off & Monster Season,ONA,8.67,14,2411,91174,"Comedy, Mystery, Supernatural",Shaft,2024,summer,2025-07-06
57334,Dan Da Dan,TV,8.5,12,286,763071,"Action, Comedy, Supernatural",Science SARU,2024,fall,2025-07-06
54857,Re:ZERO -Starting Life in Another World- Season 3,TV,8.45,16,605,418367,"Drama, Fantasy, Suspense",White Fox,2024,fall,2025-07-06
54865,Blue Lock Season 2,TV,7.56,14,922,286206,Sports,8bit,2024,fall,2025-07-06
57181,Blue Box,TV,8.21,25,1008,263569,"Romance, Sports",Telecom Animation Film,2024,fall,2025-07-06
56784,Bleach: Thousand-Year Blood War - The Conflict,TV,8.67,14,1089,242789,"Action, Adventure, Supernatural",Pierrot Films,2024,fall,2025-07-06
40333,Uzumaki: Spiral into Horror,TV,5.73,4,1136,234690,"Avant Garde, Drama, Horror, Suspense","Akatsuki, Fugaku",2024,fall,2025-07-06
52215,Orb: On the Movements of the Earth,TV,8.71,25,1225,216825,Drama,Madhouse,2024,fall,2025-07-06
58572,Shangri-La Frontier Season 2,TV,8.28,25,1236,214769,"Action, Adventure, Fantasy",C2C,2024,fall,2025-07-06
57066,Is It Wrong to Try to Pick Up Girls in a Dungeon? V,TV,7.9,15,1387,188703,"Action, Adventure, Fantasy",J.C.Staff,2024,fall,2025-07-06
50306,Seirei Gensouki: Spirit Chronicles Season 2,TV,6.87,12,1446,179290,"Action, Adventure, Fantasy, Romance",TMS Entertainment,2024,fall,2025-07-06
52995,Arifureta: From Commonplace to World's Strongest Season 3,TV,7.02,16,1460,178099,"Action, Adventure, Fantasy",asread.,2024,fall,2025-07-06
59145,Ranma ½,TV,8.01,12,1814,135797,"Action, Comedy, Romance, Ecchi",MAPPA,2024,fall,2025-07-06
56964,Yakuza Fiancé: Raise wa Tanin ga Ii,TV,7.19,12,1874,130715,Romance,Studio Deen,2024,fall,2025-07-06
58172,Let This Grieving Soul Retire,TV,7.04,13,1900,128367,"Action, Adventure, Fantasy",Zero-G,2024,fall,2025-07-06
58714,"The Most Notorious ""Talker"" Runs the World's Greatest Clan",TV,7.61,12,1921,126265,"Action, Adventure, Fantasy","Felix Film, Ga-Crew",2024,fall,2025-07-06
57611,You are Ms. Servant.,TV,7.07,12,1952,124065,"Comedy, Romance",Felix Film,2024,fall,2025-07-06
57891,Loner Life in Another World,TV,6.57,12,1962,123474,"Action, Adventure, Fantasy","Passione, Hayabusa Film",2024,fall,2025-07-06
54853,Demon Lord 2099,TV,7.45,12,2001,120373,"Action, Fantasy, Sci-Fi",J.C.Staff,2024,fall,2025-07-06
59989,Tower of God Season 2: Workshop Battle,TV,6.9,13,2017,119520,"Action, Adventure, Drama, Fantasy, Mystery",The Answer Studio,2024,fall,2025-07-06
56894,Dragon Ball Daima,TV,7.64,20,2027,118680,"Action, Adventure, Comedy, Fantasy",Toei Animation,2024,fall,2025-07-06
60022,One Piece Fan Letter,TV Special,9.04,1,2055,116549,"Action, Adventure, Fantasy",Toei Animation,2024,fall,2025-07-06
56228,I'll Become a Villainess Who Goes Down in History,TV,7.33,13,2090,114255,"Comedy, Fantasy, Romance",Maho Film,2024,fall,2025-07-06
59131,"As a Reincarnated Aristocrat, I'll Use My Appraisal Skill to Rise in the World Season 2",TV,7.46,12,2157,108103,"Adventure, Fantasy",studio MOTHER,2024,fall,2025-07-06
55994,Sword Art Online Alternative: Gun Gale Online II,TV,7.14,12,2160,107864,Action,A-1 Pictures,2024,fall,2025-07-06
55887,365 Days to the Wedding,TV,7.13,12,2164,107516,Romance,Ashi Productions,2024,fall,2025-07-06
